{
  "schemaVersion": "1",
  "id": "epub.package.nav.audit",
  "version": "1.0.0",
  "kind": "validator",
  "legacySkillSlugs": ["epub-audit"],
  "inputSchema": "contracts/schemas/v1/artifact-reference.schema.json",
  "outputSchema": "contracts/schemas/v1/inspection-report.schema.json",
  "redLines": ["metadata", "spine", "cover", "drm"],
  "permissions": {"requiresWriteAccess": false, "network": "none"},
  "execution": {"input": "epub", "output": "none"},
  "requires": []
}
