{
  "schemaVersion": "1",
  "id": "epub.notes.legacy-fallback",
  "version": "1.0.0",
  "kind": "transformer",
  "legacySkillSlugs": ["epub-legacy-footnote-fallback"],
  "inputSchema": "contracts/schemas/v1/artifact-reference.schema.json",
  "outputSchema": "contracts/schemas/v1/run-report.schema.json",
  "redLines": ["text", "anchors", "metadata"],
  "permissions": {"requiresWriteAccess": true, "network": "none"},
  "execution": {"input": "epub", "output": "single"},
  "requires": ["epub.notes.popup.normalize"]
}
