{
  "schemaVersion": "1",
  "id": "epub.kindle.compatibility.check",
  "version": "1.0.0",
  "kind": "validator",
  "legacySkillSlugs": ["epub-reader-verify"],
  "inputSchema": "contracts/schemas/v1/artifact-reference.schema.json",
  "outputSchema": "contracts/schemas/v1/inspection-report.schema.json",
  "redLines": [],
  "permissions": {"requiresWriteAccess": false, "network": "none"},
  "execution": {"input": "epub", "output": "none"},
  "requires": ["epub.package.nav.audit"]
}
