{
  "schemaVersion": "1",
  "id": "epub.image.layout.optimize",
  "version": "1.0.0",
  "kind": "planner",
  "legacySkillSlugs": ["epub-audit"],
  "inputSchema": "contracts/schemas/v1/artifact-reference.schema.json",
  "outputSchema": "contracts/schemas/v1/execution-plan.schema.json",
  "redLines": [],
  "permissions": {"requiresWriteAccess": false, "network": "none"},
  "execution": {"input": "epub", "output": "none"},
  "requires": ["epub.package.nav.audit"]
}
