{
  "schemaVersion": "1",
  "id": "epub.source.intake",
  "version": "1.0.0",
  "kind": "planner",
  "legacySkillSlugs": ["epub-source-intake"],
  "inputSchema": "contracts/schemas/v1/artifact-reference.schema.json",
  "outputSchema": "contracts/schemas/v1/execution-plan.schema.json",
  "redLines": [],
  "permissions": {"requiresWriteAccess": false, "network": "none"},
  "execution": {"input": "source-path", "output": "none"},
  "requires": []
}
