{
  "schemaVersion": "1",
  "id": "epub.css.layering.optimize",
  "version": "1.0.0",
  "kind": "transformer",
  "legacySkillSlugs": ["epub-cleanup"],
  "inputSchema": "contracts/schemas/v1/artifact-reference.schema.json",
  "outputSchema": "contracts/schemas/v1/run-report.schema.json",
  "redLines": ["text", "metadata", "spine", "anchors", "cover"],
  "permissions": {"requiresWriteAccess": true, "network": "none"},
  "execution": {"input": "epub", "output": "single"},
  "requires": ["epub.package.nav.audit"]
}
