{
  "schemaVersion": "1",
  "id": "epub.style.demo.maintain",
  "version": "1.0.0",
  "kind": "planner",
  "legacySkillSlugs": ["epub-style-demo-maintainer"],
  "inputSchema": "contracts/schemas/v1/artifact-reference.schema.json",
  "outputSchema": "contracts/schemas/v1/execution-plan.schema.json",
  "redLines": [],
  "permissions": {"requiresWriteAccess": false, "network": "none"},
  "execution": {"input": "epub-or-tree", "output": "none"},
  "requires": []
}
