{
  "schemaVersion": "1",
  "id": "epub.notes.popup.normalize",
  "version": "1.0.0",
  "kind": "transformer",
  "legacySkillSlugs": ["epub-popup-footnote-converter"],
  "inputSchema": "contracts/schemas/v1/artifact-reference.schema.json",
  "outputSchema": "contracts/schemas/v1/run-report.schema.json",
  "redLines": ["text", "anchors", "metadata"],
  "permissions": {"requiresWriteAccess": false, "network": "none"},
  "execution": {"input": "epub", "output": "none"},
  "requires": ["epub.package.nav.audit"]
}
